{"claims":{"installed_digest_integrity":{"changed_paths":1,"files":4,"mismatches":0,"status":"PASS","trees":2},"static_artifact_capture":{"captured":13,"minimum_percent":95,"percent":100.0,"status":"PASS","total":13},"unresolved_required_non_allow":{"allowed_outcomes":["ERROR","REVIEW"],"observed_outcome":"ERROR","qualifying":18,"status":"PASS","total":18}},"decision":{"acquisition_lock_exit_eligible":true,"reason_codes":[],"status":"PASS"},"schema":"aragorn/phase1-acquisition-lock-milestone/v2","source_evidence_digest":"sha256:2dd14d743a75b6047a2d1642c712f0b0ac942890d2912beb631fd236c2b8465b","workload_digest":"sha256:32a03e4b6fa8327055fd8b0d404091dc12b067897160e7b6a5abfa4ae22f64f2"}
